date_posted,link,price,city,subregion,region,post_text,is_long_list
2021-10-17T19:25:35-0700,https://sfbay.craigslist.org/sfc/lss/d/san-francisco-tutorcalculus-physics/7395578505.html,60,None,San Francisco,sf_bay_area,"Have you ever gone into a math or science test well-prepared but afterward felt like the test threw you a curveball? Do you sometimes struggle with what approach to take in solving a math problem in a topic that you already studied? I want to help ensure that doesn't happen to you or repeat itself by teaching you in a way that ensures that you not only to learn the material well but also build creativity in tackling new problems and question types. Over many years of tutoring, I've developed a knack for teaching math and physics in a way that gives students the best chance of solving a wide range of problems, including those that they've never seen before. Here is feedback from a student that benefitted from my tutoring approach:“Daniel was a huge help when I took Physics 1 in the summer. He was very responsive to emails and worked efficiently during tutoring sessions. I went from failing my first test to an A on the last. Daniel’s strategy was to make sure I was understanding the concepts so that I could creatively think my way to solve the more complex problems. I learned skills that I have used in other classes and my grades reflect that.”— Kathy R., PRE-MED STUDENT at TCUI'm having success helping students in math, physics, and statistics at high school, college, and beyond. Specific subjects I've recently taught include Algebra, Busines Statistics, AP Calculus (AB & BC), AP Statistics, AP Physics (Algebra- and Calculus-based), Business Calculus, Pre-Calculus, Calculus I, II, & III, College Physics, and University Physics. I'm good at breaking down difficult concepts and explaining the type of challenging homework problems that would naturally be expected at the AP and College levels. My tutoring skills are constantly being strengthened through feedback I seek from students. Here is another testimonial I received on my tutoring:""Daniel is by far the best tutor I have ever worked with. His knowledge in physics and math is unparalleled and if he happens to stumble upon a concept he isn’t familiar with he will work his hardest to understand it. He is very good at breaking down difficult concepts into easily understood fractions that are much easier to understand. Once, I missed school for a little longer than a week and fell behind in physics. Daniel helped teach me the topics I’d missed and when quizzed over the material I received a 100. He is kind and understanding and I would recommend him to anyone that needs help in school.""— Matt M., HIGH SCHOOL SENIOR at ALL SAINTS' EPISCOPAL SchoolAnd here's more info about my work: In my approach to tutoring, I'm very mindful that every student is unique, so I pay close attention to seeking methods that produce the best possible learning with how each individual is wired. I'm not afraid to ask feedback questions to learn what works and what doesn't. And a well-asked question would also usually stimulate thinking and help students retain learned information longer. In order to truly help my students, I am humble and willing to learn how they learn. In over 10+ years of tutoring, I've had the pleasure and privilege of helping many clients succeed.After completing my first degree, I spent a summer taking graduate courses in math and computing in linear algebra and differential equations and in scientific computing at Harvard University Summer School. Before that, I earned by B.S summa cum laude in math along with minors in computer science and economics and upper-level coursework in physics. I received a full college scholarship and a number of university-wide awards.Subjects in which I have an excellent grasp or have tutored include: Physics (College Physics I &II, University Physics I & II, AP Physics, and High School Physics)Math (All algebra till College Algebra, Geometry, Trig, Pre-Calc, Calculus I, II, & III, Business Calc, Finite Math, Integrated Math) GRE Math, GMAT Math, & SATStatistics (College-level and High School)Intro to Computer Science and Computer ProgrammingBy drawing from how I prepared and made perfect scores or scores above the 90th percentile on several standardized tests and test components,   I've also coached students on test preparation for SAT, GRE, and GMAT. This helped to further hone the depth and breadth of my tutoring skills.Virtual tutoring has been getting increasingly popular. I have a good tutoring setup by Google Meet that includes a whiteboard for writing as one would write with pencil on paper and that permanently saves lesson notes for future review and reference. The days I'm best available to respond to inquiries and to set up tutoring for are Saturdays, Tuesdays, and Thursdays.Sessions are scheduled for a minimum of one hour. Satisfactorily meeting your needs in the fairly advanced subjects I teach would usually require significant chunks of time ahead of each session to prepare and to think of good ways to explain solutions to the questions you have. With this in mind, the fee for the high-quality tutoring you'd be receiving at this busy time of the semester is $60 per hour. I look forward to serving you as best as I can. You can call or text me at 903-884-6744 or email me through this ad.    ",False
2021-10-17T19:22:23-0700,https://sfbay.craigslist.org/sfc/lss/d/san-francisco-math-tutor-all-levels-of/7395577818.html,None,San Francisco,San Francisco,sf_bay_area,"Hi,My name is Sara and I have been tutoring math for over 8 years now. I tutor all levels of math and am very good at explaining concepts and making math easy for my students. I tutor from elementary to University Calculus and even business owners who want to freshen up their math.My students see improvements as soon as after 2 or 3 sessions. I track my student's progress and make sure they receive A's in the subject. I love building relationship with my students and their parents and have had many students for years. They feel comfortable and find it fun to learn with me.I have a Bachelor and Master's degree in mechanical engineering California State university of Long Beach. I love helping other and seeing them succeed. That's the main reason why I tutor :)Please feel free to call, text or e-mail if you have any questions or would like to schedule a tutoring session appointment. I use Idroo whiteboard tool.Thank you,Sara    ",False
2021-10-17T19:15:54-0700,https://sfbay.craigslist.org/sfc/lss/d/san-francisco-math-tutor-all-levels-of/7395576349.html,None,San Francisco,San Francisco,sf_bay_area,"Hi,My name is Sara and I have been tutoring math for over 8 years now. I tutor all levels of math and am very good at explaining concepts and making math easy for my students. I tutor from elementary to University Calculus and even business owners who want to freshen up their math.My students see improvements as soon as after 2 or 3 sessions. I track my student's progress and make sure they receive A's in the subject. I love building relationship with my students and their parents and have had many students for years. They feel comfortable and find it fun to learn with me.I have a Bachelor and Master's degree in mechanical engineering California State university of Long Beach. I love helping other and seeing them succeed. That's the main reason why I tutor :)Please feel free to call, text or e-mail if you have any questions or would like to schedule a tutoring session appointment. I use Idroo whiteboard tool.Thank you,Sara    ",False
2021-10-17T17:15:25-0700,https://sfbay.craigslist.org/sby/lss/d/zoom-math-tutor-12-yrs-experience/7395542783.html,None,Santa Clara,South Bay,sf_bay_area,"I am a math teacher/tutor with over 12 years of experience tutoring middle school, high school, and college students.  I have been teaching for 5 years at the high school level, tutoring for 12+ years, and can deliver online lessons that are as productive as meeting in person.I find mathematics fun and enjoy teaching it to my students, but most importantly I know the strategies needed to succeed in math class.I believe in helping my students and will truly make an effort to help you improve.  So whether you are looking for that extra boost from a B to an A, or you are someone who has always struggled with math class, don't hesitate to invest in your future and contact me. References available upon request.Subjects I can help with:Algebra IIntermediate Algebra / Algebra 2TrigonometryPre-CalculusCalculus I + II (including AP Calc)Statistics (including AP Stats)SAT/ACT math prep925 348 3130    ",False
2021-10-17T10:46:00-0700,https://sfbay.craigslist.org/sfc/lss/d/san-francisco-math-tutor-calculus/7395380075.html,None,None,San Francisco,sf_bay_area,"☎️  (646) 450-2967 -MollySubjects tutored:● Precalculus, Calculus I & II, III, Differential Equations● AP Calculus AB & BC ● Prealgebra, Algebra I & II, Trigonometry, Geometry ● GMAT, GRE, SAT, ACT About me:With me, you will understand every step.Over the past 5 years, I've adapted my tutoring to students of all ages and learning styles.At the end of each session, I send pics of all our notes.Call/text: (646) 450-2967 ",False
2021-10-17T09:28:54-0700,https://sfbay.craigslist.org/sby/lss/d/zoom-tutoring-stanford-phd-tutor-math/7395343809.html,50,Cupertino,South Bay,sf_bay_area,"I specializes in one-on-one tutoring for all levels of math and science. I am calm, patient and encouraging and am experienced at working with students of all ages, ranging from middle school through college.  My goal as tutors is to create a positive learning environment and to encourage students to be curious, ask questions and think analytically. Depending on scheduling and convenience, I meet students at their home, a cafe or a public library. If interested, please email me and we will devise a game plan to get you started! My fee is $50/h. Subjects:"" * Math: middle school, high school and college level (including pre-algebra, algebra, geometry, trigonometry, pre-calculus, calculus and more) * Chemistry: high school and college level (including AP Chemistry) * Physics: high school and college level (including AP Physics) * SAT/ACT prep (math)(zoom tutoring only due to COVID19)    ",False
2021-10-16T18:15:10-0700,https://sfbay.craigslist.org/sby/lss/d/san-francisco-calculus-diff-eq-adv-math/7395178109.html,None,Online,South Bay,sf_bay_area,"My name is Brian Woody and I have over 20 years of experience lecturing college level mathematics and have been the highest rated professor in Nevada for the past 8 straight years (see Rate My Professor's - University of Nevada). I am the best private instructor for advanced mathematics found on the internet. I offer an elite service to a select number of students that want to achieve long-term goals in mathematics. These typically consist of science and engineering undergraduate and graduate students. SERIOUS STUDENTS ONLY, PLEASE.    Woody Calculus Consulting offers private instruction for Calculus (I, II, and III), Differential Equations, Analysis, Abstract Algebra, Number Theory, Field Theory, Galois Theory, Chaos Theory, and other advanced mathematics. Private and Group sessions are currently being held online with great success. Virtual tutoring is efficient and effective. Sessions may be recorded and made available on a private server for no additional charge.I also have over 2,000 Free Videos - tutorials, homework explanations, and study guide solutions at on our website. Google Brian M. Woody or go to BrianWoody dot com and Contact Us there (at Woody Calculus Consulting) or reply here for more information.Call or Text (530) 414-1861",False
2021-10-16T15:47:20-0700,https://sfbay.craigslist.org/sby/lss/d/sunnyvale-expert-tutor-for-writing/7395132886.html,"[90, 60, 40]",Cupertino,South Bay,sf_bay_area,"Don't wait to get a tutor! This applies to struggling students or brilliant ones, as I can help both achieve their best.Would your student perform better in his or her subjects with a weekly tutor? I am here to help. I am a master tutor with fifteen years of experience bringing out the best of my students. I can help your student improve their English and Math skills, and maximize both learning and grades.I earned a graduate degree from Harvard University, and I specialize adapting my teaching style to each unique student. Additionally, I have lived overseas for five years, and so I have a speciality helping students who have English as a second language (ESL). I can help you with the following:ENGLISH: English classes,Writing, Grammar, StyleHISTORY & OTHER LIBERAL ARTS: History, Social Studies, Government, Political Science, etc.MATH: Arithmetic, Fractions, Algebra, Geometry, TrigonometrySCIENCE: Chemistry, Biology, PhysicsIndividualized TutoringEach student is different and I listen carefully so that our sessions are most productive. There is no substitute for one-on-one tutoring.Short Term or Long TermSome students have stayed with me their entire high school career. Others need just a bit of help to complete a difficult assignment. RatesIndividualized tutoring costs $90/hr for in-person or $60/hr for online. (AT LEAST UNTIL MAY  2022 CORONA VIRUS PRICING: $40/hr for online weekdays.) The introductory meeting is free without any obligation. I tutor online or in-person, and I use google docs and a whiteboard program for online students. Online tutoring works very well.NOTE: If your income has been disrupted due to the coronavirus, please indicate the hourly rate you are able to pay. ContactYou can text me or simply reply to this ad and we'll arrange a Zoom meeting.kenaritutor.com    ",True
2021-10-16T13:53:46-0700,https://sfbay.craigslist.org/nby/lss/d/greenbrae-tutor-harvard-grad-30-yrs/7395084963.html,None,Kentfield / Ross,North Bay,sf_bay_area,"Hi,My name is Chris Dingman. I'm a uniquely qualified, Bay Area-based math, science, writing, and SAT/ACT tutor. For the past year or so, I have done all tutoring online, which works well for one-on-one (less well for teaching groups!), but being fully vaccinated, I am now offering both in-person and online options.  I offer tutoring to both single students or groups, though I believe one-on-one tutoring is usually the most helpful. Since graduating summa cum laude from Harvard in 1987, I've been tutoring both in-person and online, teaching in both classrooms and homeschools, and helping various companies develop educational materials. In more than 30 years as a teacher and tutor, I have taught every middle and high school math course from pre-algebra through Calculus, and every high school science course. I am also a professional writer. I can help with: MATH: from basic arithmetic  through pre-algebra, algebra I, algebra II, geometry, trigonometry, pre-Calculus, and Calculus SCIENCE: including biology, chemistry, and physicsWRITING: including organizational help, sentence structure/style, and grammarI also specialize in ACT and SAT test prep. Along with my private practice, I've worked with educational content developers in the San Francisco Bay Area, which specialize in the creation and delivery of test-prep materials. You can find out more about me at my website at www.AchieveWithEaseTutoring.com, or read below for a little more about what I offer. My Approach:Teaching isn’t just knowing the answers. It’s an art. Current circumstances of course prohibit classroom teaching, but classrooms are often not the best environments in which to practice the art of teaching anyway. Working with me, teens feel a sense of calm and  confidence that allows them to think clearly, ask questions, tap into their natural desire to succeed, and to succeed.My tutoring approach is easy-going, focused, and highly individualized. These three elements complement and amplify each other. Time spent with me is more efficient and effective than classroom instruction, which must use what I call a one-size-fits-none approach. I help create a relaxed atmosphere and authentic connection that puts students at ease and allows optimal learning. Students often succeed with me even when they've been frustrated by subjects or other tutors and teachers. Students almost always see both their confidence and grades go up.I have outstanding references available on request.Online Tutoring PlatformsSkype or Gmail Video Chat are effective and convenient ways to tutor. While maintaining a visual connection to the student, I can use my computer as a whiteboard which I share with the student. (All whiteboard notes can be sent to the student after the session.)ContactYou can contact me from my website at www.achievewitheasetutoring.com, or call me at 510-499-5979.I look forward to hearing from you with any questions you may have.Chris    ",False
2021-10-16T13:53:14-0700,https://sfbay.craigslist.org/eby/lss/d/lafayette-tutor-harvard-grad-30-years/7395084739.html,None,Lafayette / Orinda / Moraga,East Bay,sf_bay_area,"Hi,My name is Chris Dingman. I'm a uniquely qualified, Bay Area-based math, science, writing, and SAT/ACT tutor.For the past year or so, I have done all tutoring online, which works well for one-on-one (less well for teaching groups!), but being fully vaccinated, I am now offering both in-person and online options.Since graduating summa cum laude from Harvard in 1987, I've been tutoring both in-person and online, teaching in both classrooms and homeschools, and helping various companies develop educational materials. In more than 30 years as a teacher and tutor, I have taught every middle and high school math course from pre-algebra through Calculus, and every high school science course. I am also a professional writer. I can help with: MATH: from basic arithmetic  through pre-algebra, algebra I, algebra II, geometry, trigonometry, pre-Calculus, and Calculus SCIENCE: including biology, chemistry, and physicsWRITING: including organizational help, sentence structure/style, and grammarI also specialize in ACT and SAT test prep. Along with my private practice, I've worked with educational content developers in the San Francisco Bay Area, which specialize in the creation and delivery of test-prep materials. You can find out more about me at my website at www.AchieveWithEaseTutoring.com, or read below for a little more about what I offer. My Approach:Teaching isn’t just knowing the answers. It’s an art. Current circumstances of course prohibit classroom teaching, but classrooms are often not the best environments in which to practice the art of teaching anyway. Working with me, teens feel a sense of calm and  confidence that allows them to think clearly, ask questions, tap into their natural desire to succeed, and to succeed.My tutoring approach is easy-going, focused, and highly individualized. These three elements complement and amplify each other. Time spent with me is more efficient and effective than classroom instruction, which must use what I call a one-size-fits-none approach. I help create a relaxed atmosphere and authentic connection that puts students at ease and allows optimal learning. Students often succeed with me even when they've been frustrated by subjects or other tutors and teachers. Students almost always see both their confidence and grades go up.I have outstanding references available on request.Online Tutoring PlatformsSkype or Gmail Video Chat are effective and convenient ways to tutor. While maintaining a visual connection to the student, I can use my computer as a whiteboard which I share with the student. (All whiteboard notes can be sent to the student after the session.)ContactYou can contact me from my website at www.achievewitheasetutoring.com, or call me at 510-499-5979.I look forward to hearing from you with any questions you may have.Chris    ",False
2021-10-16T13:39:11-0700,https://sfbay.craigslist.org/sby/lss/d/sunnyvale-tutor-for-math-english/7395078274.html,None,Sunnyvale,South Bay,sf_bay_area,"Please text me at 408-877-5379.My name is Julia and I can help you with your tutoring needs.I have the experience, knowledge and skills to help you improve in your desired subject or test. I know what it takes to get a high score on the SAT, ACT, GMAT, GRE, LSAT and MCAT as well as get into a top tier school. Let me show you how to “crack the code” to success.Educational Background:University of Chicago (undergrad)Yale University (grad)SAT: 1540/1600ACT: 35/36GMAT: 780GRE: 330MCAT:520LSAT: 177Here are the areas I can help with:Basic Math, Pre-Algebra, Algebra 1 & 2, Intermediate Algebra, College Algebra, Problem Solving, Geometry, Pre-Calculus, CalculusGeneral Chemistry, College Chemistry, AP Chemistry, AP Physics, Mechanics, General Science, Biology, Earth Science, Quantum PhysicsEnglish, Essay writingTEST PREPARATION: SAT, ACT, GMAT, GRE, LSAT, PSAT, GED, HSPT, TOEFLI look forward to helping you.San Francisco. California, Alameda, Albany, American Canyon, Antioch, Atherton, Belmont, Belvedere, Benicia, Berkeley, Brentwood, Brisbane, Burlingame, Calistoga, Campbell, Clayton, Cloverdale, Colma, Concord, Corte Madera, Cotati, Cupertino, Daly City, Danville, Dixon, Dublin, East Palo Alto, El Cerrito, Emeryville, Fairfax, Fairfield, Foster City, Fremont, Gilroy, Half Moon Bay, Hayward, Healdsburg, Hercules, Hillsborough, Lafayette, Larkspur, Livermore, Los Altos, Los Altos Hills, Los Gatos, Martinez, Menlo Park, Mill Valley, Millbrae, Milpitas, Monte Sereno, Moraga, Morgan Hill, Mountain View, Napa, Newark, Novato, Oakland, Oakley, Orinda, Pacifica, Palo Alto, Petaluma, Piedmont, Pinole, Pittsburg, Pleasant Hill, Pleasanton, Portola Valley, Redwood City, Richmond, Rio Vista, Rohnert Park, Ross, St. Helena, San Anselmo, San Bruno, San Carlos, San Francisco, San Jose, San Leandro, San Mateo, San Pablo, San Rafael, San Ramon, Santa Clara, Santa Rosa, Saratoga, Sausalito, Sebastopol, Sonoma, South San Francisco, Suisun City, Sunnyvale, Tiburon, Union City, Vacaville, Vallejo, Walnut Creek, CA    ",False
2021-10-16T10:55:39-0700,https://sfbay.craigslist.org/pen/lss/d/stanford-phd-tutor-for-math-and-science/7394992462.html,50,Palo Alto,Peninsula,sf_bay_area,"I am an experienced male tutor with PhD degree from Stanford University (engineering). I teach math and science for middle school and high school students. While I am working in technology industry, I also enjoy teaching. I am currently teaching about 10 students, and looking for a few students for winter. My goal is helping students to achieve various goal (improving GPA, establishing the way to study, developing problem solving skill...). I teach at students' home or public places such as coffee shops. My rate is $50/h flat rate. Zoom tutoring is also available.(Currently only Zoom sessions are available.) Reference is available upon request. Subjects general math algebra trigonometry geometry pre calculus analysisH AP calculusAB/BC multivariable calculus physics/AP physics chemistry/AP chemistry SAT (math, physics, and chemistry)/ACT Please feel free to send me an e-mail if you are interested in my service.  Thank you.    ",False
2021-11-07T09:30:47-0800,https://sfbay.craigslist.org/sfc/lss/d/san-francisco-spss-statistics-geometry/7404764976.html,"[50, 100, 135]",San Francisco,San Francisco,sf_bay_area,"I hope everything is fine and I am glad to have you here. I am fully vaccinated and available to meet in – person and Online tooSpecialization:I hold a Doctorate in Statistics with an Undergraduate Degree in Math (Major)15+ years of tutoring experience via digital board.Get: 1. 100% Excellence work2. A+ Grade3. 100% buyer satisfaction with excellent teaching 4. Fee after work done5. Teach concept in effective mannerService specifics:College Algebra Integration Differential equations Limits Series Linear Algebra Linear Programming Operations research Numerical Analysis Mathematics Advanced Calculus 1 Calculus 2 Calculus 3 Trigonometry Vectors Higher Mathematics Complex analysis Pre-calculus Complex analysis Discrete Finite Math Differentiation Excel Tableau Pre-Algebra Tutor MinitabRate:Zoom 1-on-1 tutoring$50 First hour (1hr) $100 (2hrs)$135 (3hrs)Credentials:Worked for 2 companies namedDatameer (2014-2017) as a Statistics Data AnalysisIBM (2017 onwards) as a Senior Statistician Tutoring Keywords: MATH 116 Calc MBA 626, 215, QMS 423, BUS 14A, BUS 14B, Pre-Calculus MATH 1 (UCLA) STATISTICS 10 (UCLA), MATH 10A (UCSD), MATH 10B (UCSD), MATH 20A (UCSD), MATH 20B (UCSD), MATH 20C (UCSD), MATH 20D (UCSD), MATH 11 (UCSD), MATH 2 (UCSD),Math12400MATH 8 (SMC), MATH 31A (UCLA), MATH 112, MATH 120, MATH 102 (LMU), MATH 142, MATH 241/242, STAT 015, STAT 050, MATH 10, MAT 191, MATH 114, MATH 117, MATH 110C, MATH 130C, MATH 131, MATH 137,, MATH 138, MATH 150C, MATH 160C, MATH 138, MATH 150, MATH 160, MATH 200, MATH 220 (SBCC), MATH 124MAT 192, MAT 131, MAT 321, MAT 421, MAT 131, MATH 227, QMS 321, IS 310 MAT240, (CSULB),MAT 323, MAE 505, MATH 2 (UCSD), MATH 3C (UCSD), MATH 4C (UCSD)I can send you either a hand written or a word document according to your need. For live - Hand written work in specific time.",True
2021-11-06T23:56:35-0700,https://sfbay.craigslist.org/sfc/lss/d/san-francisco-math-physics-sat-gre-esl/7404623756.html,None,None,San Francisco,sf_bay_area,"I hold a Bsc, Msc, and a Phd in cognitive neuroscience (former Stanford intern) with some scientific publications. SFSU Physics graduate.Can tutor face to face or online by Skype, Zoom etc.I teach Math, Physics, Italian, SAT, GRE, ESL, TOEFL.10 years of experience as tutor.I teach every level from elementary, high school to colleges, am very patient, really take care of my students, enjoy teaching and make sure the student really understand and master the topics.    ",False
