date_posted,link,price,city,subregion,region,post_text,is_long_list
2021-11-07T17:29:13-0800,https://sfbay.craigslist.org/sfc/lss/d/san-francisco-math-tutor-all-levels-of/7404956172.html,None,San Francisco,San Francisco,sf_bay_area,"Hi,My name is Sara and I have been tutoring math for over 8 years now. I tutor all levels of math and am very good at explaining concepts and making math easy for my students. I tutor from elementary to University Calculus and even business owners who want to freshen up their math.My students see improvements as soon as after 2 or 3 sessions. I track my student's progress and make sure they receive A's in the subject. I love building relationship with my students and their parents and have had many students for years. They feel comfortable and find it fun to learn with me.I have a Bachelor and Master's degree in mechanical engineering California State university of Long Beach. I love helping other and seeing them succeed. That's the main reason why I tutor :)Please feel free to call, text or e-mail if you have any questions or would like to schedule a tutoring session appointment. I use Idroo whiteboard tool.Thank you,Sara    ",False
2021-11-07T14:45:07-0800,https://sfbay.craigslist.org/sfc/lss/d/san-francisco-ivy-league-tutor-sat-act/7404902411.html,None,None,San Francisco,sf_bay_area,"Professional full-time tutor available for your tutoring needs. I’m highly experienced with a strong track record of helping students increase grades and test scores. I take pride in bringing out the full academic potential from my students.Contact me (call or text) at 415-508-7957Educational Background:University of Pennsylvania(Undergrad)Harvard University(Grad)ACT 35SAT 1580LSAT 176MCAT 524GRE 334GMAT 790I have 4 years of classroom teaching experience at a public school. I also have 3 years of work experience teaching at a tutoring center. I went on my own and have been doing online and in-person tutoring for the past 4 years.Subjects I tutor: Geometry, Calculus, Algebra, Pre-calculus, Trigonometry, Biology, Physics, Chemistry, Organic Chemistry, Anatomy and Physiology, Psychology, Earth Science, Environmental Science, General Science, English Literature, Language and Writing, AP courses, and History.Tests I tutor:  SAT, ACT, GMAT, GRE, LSAT, MCAT, MAT, GED, ISEE, HSPT, TOEFL, IELTSOther services: Admission counseling, editing resume and cover letters, interview tips, essay writing, writing personal statementsRate: varies depending on location, subject and the type of tutoring selected.Please contact me by responding to this listing with your name and contact number along with the subject or exam you need help with. I’ll get back to you as soon as I can to discuss plans.    ",False
2021-11-07T12:57:46-0800,https://sfbay.craigslist.org/nby/lss/d/petaluma-experienced-highly-regarded/7404859993.html,45,Petaluma,North Bay,sf_bay_area,"I am a former high school math teacher with a combined 30+ years teaching and tutoring.  I have an excellent ability to explain concepts so students understand clearly.  I was a tutor for many years before teaching high school; I have a ton of experience tutoring students with all manner of learning styles.  I am patient and logical; I know how to create a comfort zone for students.Middle school, high school, college math courses including Statistics.  Also I am well versed in the Common Core curriculum used by many schools.I am set up to do remote tutoring if that is your preference/need.My rate is $45 per hour.  I am not a ""clock watching"" tutor; if a session needs to run a bit long you will not be charged for the extra time.References are available upon request.David    ",False
2021-11-07T12:46:41-0800,https://sfbay.craigslist.org/pen/lss/d/south-san-francisco-math-tutor-algebra/7404855370.html,25,South San Francisco,Peninsula,sf_bay_area,"If you need an online or in-person Math Tutor on the following subjects at Middle School,  High School,  or College level, we can help you! Tutorials: Mathematics, Algebra 1 & 2, Geometry, Trigonometry, PreCalculus, AP Calculus/Calculus, AP Statistics/Statistics, Linear Algebra, Physics, and Econometrics. Test Preparations:  SAT, SSAT, ISEE, and Electrical Apprenticeship Math.Rate starts at $25/hour    ",False
2021-11-07T12:44:36-0800,https://sfbay.craigslist.org/eby/lss/d/lafayette-tutor-harvard-grad-30-years/7404854567.html,None,Lafayette / Orinda / Moraga,East Bay,sf_bay_area,"Hi,My name is Chris Dingman. I'm a uniquely qualified, Bay Area-based math, science, writing, and SAT/ACT tutor.For the past year or so, I have done all tutoring online, which works well for one-on-one (less well for teaching groups!), but being fully vaccinated, I am now offering both in-person and online options.Since graduating summa cum laude from Harvard in 1987, I've been tutoring both in-person and online, teaching in both classrooms and homeschools, and helping various companies develop educational materials. In more than 30 years as a teacher and tutor, I have taught every middle and high school math course from pre-algebra through Calculus, and every high school science course. I am also a professional writer. I can help with: MATH: from basic arithmetic  through pre-algebra, algebra I, algebra II, geometry, trigonometry, pre-Calculus, and Calculus SCIENCE: including biology, chemistry, and physicsWRITING: including organizational help, sentence structure/style, and grammarI also specialize in ACT and SAT test prep. Along with my private practice, I've worked with educational content developers in the San Francisco Bay Area, which specialize in the creation and delivery of test-prep materials. You can find out more about me at my website at www.AchieveWithEaseTutoring.com, or read below for a little more about what I offer. My Approach:Teaching isn’t just knowing the answers. It’s an art. Current circumstances of course prohibit classroom teaching, but classrooms are often not the best environments in which to practice the art of teaching anyway. Working with me, teens feel a sense of calm and  confidence that allows them to think clearly, ask questions, tap into their natural desire to succeed, and to succeed.My tutoring approach is easy-going, focused, and highly individualized. These three elements complement and amplify each other. Time spent with me is more efficient and effective than classroom instruction, which must use what I call a one-size-fits-none approach. I help create a relaxed atmosphere and authentic connection that puts students at ease and allows optimal learning. Students often succeed with me even when they've been frustrated by subjects or other tutors and teachers. Students almost always see both their confidence and grades go up.I have outstanding references available on request.Online Tutoring PlatformsSkype or Gmail Video Chat are effective and convenient ways to tutor. While maintaining a visual connection to the student, I can use my computer as a whiteboard which I share with the student. (All whiteboard notes can be sent to the student after the session.)ContactYou can contact me from my website at www.achievewitheasetutoring.com, or call me at 510-499-5979.I look forward to hearing from you with any questions you may have.Chris    ",False
2021-11-07T12:44:11-0800,https://sfbay.craigslist.org/nby/lss/d/greenbrae-tutor-harvard-grad-30-yrs/7404854384.html,None,Kentfield / Ross,North Bay,sf_bay_area,"Hi,My name is Chris Dingman. I'm a uniquely qualified, Bay Area-based math, science, writing, and SAT/ACT tutor. For the past year or so, I have done all tutoring online, which works well for one-on-one (less well for teaching groups!), but being fully vaccinated, I am now offering both in-person and online options.  I offer tutoring to both single students or groups, though I believe one-on-one tutoring is usually the most helpful. Since graduating summa cum laude from Harvard in 1987, I've been tutoring both in-person and online, teaching in both classrooms and homeschools, and helping various companies develop educational materials. In more than 30 years as a teacher and tutor, I have taught every middle and high school math course from pre-algebra through Calculus, and every high school science course. I am also a professional writer. I can help with: MATH: from basic arithmetic  through pre-algebra, algebra I, algebra II, geometry, trigonometry, pre-Calculus, and Calculus SCIENCE: including biology, chemistry, and physicsWRITING: including organizational help, sentence structure/style, and grammarI also specialize in ACT and SAT test prep. Along with my private practice, I've worked with educational content developers in the San Francisco Bay Area, which specialize in the creation and delivery of test-prep materials. You can find out more about me at my website at www.AchieveWithEaseTutoring.com, or read below for a little more about what I offer. My Approach:Teaching isn’t just knowing the answers. It’s an art. Current circumstances of course prohibit classroom teaching, but classrooms are often not the best environments in which to practice the art of teaching anyway. Working with me, teens feel a sense of calm and  confidence that allows them to think clearly, ask questions, tap into their natural desire to succeed, and to succeed.My tutoring approach is easy-going, focused, and highly individualized. These three elements complement and amplify each other. Time spent with me is more efficient and effective than classroom instruction, which must use what I call a one-size-fits-none approach. I help create a relaxed atmosphere and authentic connection that puts students at ease and allows optimal learning. Students often succeed with me even when they've been frustrated by subjects or other tutors and teachers. Students almost always see both their confidence and grades go up.I have outstanding references available on request.Online Tutoring PlatformsSkype or Gmail Video Chat are effective and convenient ways to tutor. While maintaining a visual connection to the student, I can use my computer as a whiteboard which I share with the student. (All whiteboard notes can be sent to the student after the session.)ContactYou can contact me from my website at www.achievewitheasetutoring.com, or call me at 510-499-5979.I look forward to hearing from you with any questions you may have.Chris    ",False
2021-11-07T08:40:18-0800,https://sfbay.craigslist.org/sfc/lss/d/torrance-college-math-tutor-calculus-ii/7404740726.html,"[30, 40, 30, 40, 30, 40, 40, 40]",Online,San Francisco,sf_bay_area,"★★ College Math Tutor★ Calculus I ,II & III, AP Calculus AB/BC , Trig, College Algebra, College Statistics, Linear Algebra, ODEWebsite :www.collegemathcourses.comYouTube :(Under Construction)https://www.youtube.com/channel/UCqhFZRmUqOAAPMQpo58TV7g★★All tutoring is done by One Tutor. ★★Elementary Statistics and ProbabilityIntroduction to Statistical ReasoningProbability and StatisticsMathematical StatisticsPre-AlgebraIntermediate AlgebraCollege Algebra/Algebra 1/Algebra 2GeometryTrigonometry (Trig)Finite MathematicsPre-Calculus /Math AnalysisCalculus I , II and IIIVector CalculusIntroduction Linear Algebra (Matrix)Finite Mathematics===For Engineering students ========================Advanced CalculusDifferential and Integral CalculusMultiple Variable CalculusApplied Statistics and Probability for EngineersComplex NumbersDifferential EquationEngineering Analysis===For MBA and EMBA students ====================Business StatisticsBusiness CalculusIntroduction to Statistical ReasoningOperational ResearchOptimizationQuantitative AnalysisDecision AnalysisManagement ScienceLinear ProgrammingTransportation ProblemsExcel TableauMathematics and PoliticsProject ManagementTest PreparationSATCBEST, CSET I, II and III (MATHEMATICS for HS and Middle school Teachers)============== ★★ ★★ =======================================GRE MATH (My GRE MATH Score : 800/800)============================================================GMAT MATHAP Calculus AB and BCAP StatisticsGraphing Calculation helpHourly Rate : Depending on the subject: ==== Most Math/Stats Subjects $30-40/hr ================= ★★ $30/hr - $40/hr ★★ ====================================Assignment Help, Homework Help -Step by Step Solutions Rate :$30/hr - $40/hr================================================================================== ★★ $40/hr ★★ =======================================Zoom 1-on-1 tutoring : $40/hr====================================================================★ I can help students with their homework assignments , projects, and prepare for the Exams★★ I will forward you a PDF file of the notes and problems solved during the tutoring session if needed★==★★ Exp University Level Math Tutor (MS Applied Mathematics, MS Applied Statistics and MS Aerospace Engineering) ★★ ================ ★★ ★★ =======================================GRE MATH (My GRE MATH Score : 800/800)============================================================★★ You're not paying for the hours or minutes but for Education, Knowledge and Experience ★★★★★★★★ Text/ Email Preferred (Text for a Faster Response ) ★★★★★★============================================================================Keywords: High School, Middle School, College, University, Home school, Online Help, Google Drive, Zoom, Screen share, whiteboard, , Graphing Calculator Help, Consultation, STEM, Excel, statcrunch, F201, MBA 626, QUMS 505, BUAD 310 (USC), QBUS 215, MATH 227, QMS 321, IS 310 (CSULB), QMS 423, BUS 14A, BUS 14B, Pre-Calculus MATH 1 (UCLA), Introduction to Statistical Reasoning STATISTICS 10 (UCLA), MATH 8 (SMC), MATH 31A (UCLA), MATH 112, MATH 120, MATH 102 (LMU), MATH 142, MATH 241/242, STAT 015, STAT 050, MATH 10, MAT 191, MAT 192, MAT 131, MAT 321, MAT 421, MAT 131, MAT 323, MAE 505, PPD 502X, Psych 210, Psy 3307 , MA-336 (CUNY), MA-114 (CUNY), MA-119 (CUNY) , MA-441 (CUNY), MA-442 (CUNY), MA-440(CUNY), MA-261 (CUNY), MA-121 (CUNY), MA-120 (CUNY), MA-10 (CUNY), MATH 2 (UCSD), MATH 3C (UCSD), MATH 4C (UCSD), MATH 10A (UCSD), MATH 10B (UCSD), MATH 20A (UCSD), MATH 20B (UCSD), MATH 20C (UCSD), MATH 20D (UCSD), MATH 11 (UCSD), MATH 2 (UCSD),Math 165 (El Camino), Math12400,.....(SMC) Math 1, Math 2, Math 2C, Math 3, Math 3C, Math 4, Math 4C, Math 7, Math 8, Math 15, Math 18, Math 20, Math 21C, Math 26, Math 26C, Math 28, Math 29, Math 31, Math 32, Math 41, Math 50, Math 54,Math 54C,Math 81,Math 84,Math 85 (SMC)(SBCC) MATH 114, MATH 117, MATH 110C, MATH 130C, MATH 131, MATH 137,, MATH 138, MATH 150C, MATH 160C, MATH 138, MATH 150, MATH 160, MATH 200, MATH 220 (SBCC), MATH 124, MATH 1040 (Honors), MAT 241 ( Calculus 3/ Illinois)Calculus II :Convergence TEST & Divergence TESTAbsolutely ConvergentConditionally ConvergentGeometric Seriesp-SeriesDirect ComparisonLimit ComparisonRatio TestRoot TestIntegral TestAlternating SeriesCalculus III3D Coordinate SystemsVector FunctionsPartial DerivativesMaximum and Minimum Values (With constraints)Multiple IntegralsVector CalculusLine IntegralsSurface IntegralsApplications (Calculus 1, 2 and 3)College Statistics :Elasticity, ANOVA, Z , t , Normal, Poisson, Binomial, Exponential, Uniform, Negative Binomial, Hyper-geometric distributions , Trigonometry, Integration, Integration by Parts, Differentiation, derivative , Theory of Voting, Majority Rule, Voting Methods, Voting Power, Minimum Spanning tree , Shortest path, spanning tree , PERT, CPM, ALEKS, Cengage ,Canvas, MyMathLab , MyStatLab ,Pearson , Wiley , Brightspace, MyOpenMath, Connect,Webwork. ConnectMath, StraighterLine , Statcrunch ,WebAssign , Lumenohm. etc    ",True
2021-11-05T11:16:52-0700,https://sfbay.craigslist.org/sfc/lss/d/san-francisco-experienced-math-and/7403946324.html,None,San Francisco,San Francisco,sf_bay_area,"Senior tutor of mathematics and physics. Ph.D. in Chemistry with over 20 years of tutoring and teaching experience seeks bright high school and college students who require a little help. I am especially adept at explaining difficult concepts in a comprehensible way. Math areas include algebra, geometry, trigonometry, and calculus. Science areas include force/motion, magnetism, electricity, physics, and chemistry.  $75/1.5 hours. You can come to my home in the outer Richmond or we can do zoom. Fully vaccinated.Call Dr. William Stollar at 415-640-8917    ",False
2021-11-05T10:20:37-0700,https://sfbay.craigslist.org/sby/lss/d/sunnyvale-expert-tutor-for-writing/7403913655.html,"[90, 60, 40]",Cupertino,South Bay,sf_bay_area,"Don't wait to get a tutor! This applies to struggling students or brilliant ones, as I can help both achieve their best.Would your student perform better in his or her subjects with a weekly tutor? I am here to help. I am a master tutor with fifteen years of experience bringing out the best of my students. I can help your student improve their English and Math skills, and maximize both learning and grades.I earned a graduate degree from Harvard University, and I specialize adapting my teaching style to each unique student. Additionally, I have lived overseas for five years, and so I have a speciality helping students who have English as a second language (ESL). I can help you with the following:ENGLISH: English classes,Writing, Grammar, StyleHISTORY & OTHER LIBERAL ARTS: History, Social Studies, Government, Political Science, etc.MATH: Arithmetic, Fractions, Algebra, Geometry, TrigonometrySCIENCE: Chemistry, Biology, PhysicsIndividualized TutoringEach student is different and I listen carefully so that our sessions are most productive. There is no substitute for one-on-one tutoring.Short Term or Long TermSome students have stayed with me their entire high school career. Others need just a bit of help to complete a difficult assignment. RatesIndividualized tutoring costs $90/hr for in-person or $60/hr for online. (AT LEAST UNTIL MAY  2022 CORONA VIRUS PRICING: $40/hr for online weekdays.) The introductory meeting is free without any obligation. I tutor online or in-person, and I use google docs and a whiteboard program for online students. Online tutoring works very well.NOTE: If your income has been disrupted due to the coronavirus, please indicate the hourly rate you are able to pay. ContactYou can text me or simply reply to this ad and we'll arrange a Zoom meeting.kenaritutor.com    ",True
2021-11-04T16:41:29-0700,https://sfbay.craigslist.org/sfc/lss/d/san-francisco-math-tutor-all-levels-of/7403645711.html,None,San Francisco,San Francisco,sf_bay_area,"Hi,My name is Sara and I have been tutoring math for over 8 years now. I tutor all levels of math and am very good at explaining concepts and making math easy for my students. I tutor from elementary to University Calculus and even business owners who want to freshen up their math.My students see improvements as soon as after 2 or 3 sessions. I track my student's progress and make sure they receive A's in the subject. I love building relationship with my students and their parents and have had many students for years. They feel comfortable and find it fun to learn with me.I have a Bachelor and Master's degree in mechanical engineering California State university of Long Beach. I love helping other and seeing them succeed. That's the main reason why I tutor :)Please feel free to call, text or e-mail if you have any questions or would like to schedule a tutoring session appointment. I use Idroo whiteboard tool.In this video I tell you about our tutoring techniques :) https://www.youtube.com/watch?v=AFpLs_h93P0&t=6s&ab_channel=ExcellenceTutorsThank you,Sara    ",False
2021-11-04T16:34:52-0700,https://sfbay.craigslist.org/sfc/lss/d/san-francisco-math-tutor-all-levels-of/7403643466.html,None,San Francisco,San Francisco,sf_bay_area,"Hi,My name is Sara and I have been tutoring math for over 8 years now. I tutor all levels of math and am very good at explaining concepts and making math easy for my students. I tutor from elementary to University Calculus and even business owners who want to freshen up their math.My students see improvements as soon as after 2 or 3 sessions. I track my student's progress and make sure they receive A's in the subject. I love building relationship with my students and their parents and have had many students for years. They feel comfortable and find it fun to learn with me.I have a Bachelor and Master's degree in mechanical engineering California State university of Long Beach. I love helping other and seeing them succeed. That's the main reason why I tutor :)Please feel free to call, text or e-mail if you have any questions or would like to schedule a tutoring session appointment. I use Idroo whiteboard tool.Thank you,Sara    ",False
2021-11-04T16:32:28-0700,https://sfbay.craigslist.org/sfc/lss/d/san-francisco-math-tutor-all-levels-of/7403642574.html,None,San Francisco,San Francisco,sf_bay_area,"Hi,My name is Sara and I have been tutoring math for over 8 years now. I tutor all levels of math and am very good at explaining concepts and making math easy for my students. I tutor from elementary to University Calculus and even business owners who want to freshen up their math.My students see improvements as soon as after 2 or 3 sessions. I track my student's progress and make sure they receive A's in the subject. I love building relationship with my students and their parents and have had many students for years. They feel comfortable and find it fun to learn with me.I have a Bachelor and Master's degree in mechanical engineering California State university of Long Beach. I love helping other and seeing them succeed. That's the main reason why I tutor :)Please feel free to call, text or e-mail if you have any questions or would like to schedule a tutoring session appointment. I use Idroo whiteboard tool.Thank you,Sara    ",False
2021-11-04T13:25:57-0700,https://sfbay.craigslist.org/sby/lss/d/san-jose-experienced-math-science-sat/7403561579.html,35,San Jose,South Bay,sf_bay_area,"Hello All,My name is Qusai. I have been a tutor and a teaching assistant for over 7 years. I recently graduated from UC Santa Barbara where I used to teach undergraduate students. I have taught and tutored more than 200 students and have put in more than 300 hours of teaching time. The most important aspect of tutoring, in my opinion, is to identify and fill in gaps in their knowledge. The last thing you want is your child having trouble with a specific concept because their foundation was shaky. I can help make sure there are no gaps in their knowledge and make sure they are performing well in school.Some places I have taught:- Los Angeles Pierce College- UC Santa Barbara- For a Company in Shanghai, China- Private Clients in LAQualifications:Undergrad: UC BerkeleyGrad: UC Santa Barbara(Check out some of my reviews in the images attached)If you are looking to help your child in high school or college, reach out to me. I can help break things down and get them back on track towards a positive future.Rate: $35/hourOnline TutoringNote: I have all the tools for effective online tutoring including screen share and a stylus/digital white board.Text, call, or email- Qusai from QS Tutoring",False
2021-11-04T05:28:52-0700,https://sfbay.craigslist.org/sfc/lss/d/san-francisco-experienced-math-stats/7403319058.html,None,None,San Francisco,sf_bay_area,"I'm a PHD student of Economics at NYU, I have a B.S. and a M.S degree in Mathematics. I have 2 years of teaching experience at bachelors and masters level. I have had outstanding TA evaluations.I tutor all levels of mathematics (Algebra, Calculus, Probability and Statistics, Linear Algebra, Geometry etc.) in COLLEGE and HIGH SCHOOL level. I also tutor Microeconomics and Game Theory. I am also an ex math Olympian. I have medals in the International Mathematical Olympiads. I have experience of teaching at Math Olympiads training camps in high school and middle school level. I tutor all levels of Math Olympiads.Call/text or email for further information.    ",False
2021-11-03T19:17:34-0700,https://sfbay.craigslist.org/sfc/lss/d/san-francisco-statistics-and-math-tutor/7403243285.html,None,San Francisco,San Francisco,sf_bay_area,I am PhD graduate with more than 10 years tutoring experience in statistics and mathematics. I specialize in graduate level subjects such as Bayesian statistics machine learning APA format SPSS R studio Python MATLAB Stata Excel Jamovi and other software    ,False
2021-11-03T14:20:49-0700,https://sfbay.craigslist.org/pen/lss/d/palo-alto-stanford-phd-math-and-physics/7403137978.html,65.0,Palo Alto,Peninsula,sf_bay_area,"Need extra help to further excel in your desired subject? I am an experienced Math and Physics tutor to provide learning services to students in high school and college to improve in their courses. I have my PhD in Applied Physics from Stanford University and my undergraduate degree in Engineering Physics, specializing in Electrical Engineering. I am available via zoom or in person locally in the Peninsula and East Bay Area.High school courses $60/hrCollege courses $70/hrPlease feel free to reach out if you have any questions or are interested in my services. Thank you.",False
