date_posted,link,price,city,subregion,region,post_text,is_long_list
2021-10-26T09:57:09-0700,https://sfbay.craigslist.org/sby/lss/d/sunnyvale-expert-tutor-for-writing/7399453032.html,"[90, 60, 40]",Cupertino,South Bay,sf_bay_area,"Don't wait to get a tutor! This applies to struggling students or brilliant ones, as I can help both achieve their best.Would your student perform better in his or her subjects with a weekly tutor? I am here to help. I am a master tutor with fifteen years of experience bringing out the best of my students. I can help your student improve their English and Math skills, and maximize both learning and grades.I earned a graduate degree from Harvard University, and I specialize adapting my teaching style to each unique student. Additionally, I have lived overseas for five years, and so I have a speciality helping students who have English as a second language (ESL). I can help you with the following:ENGLISH: English classes,Writing, Grammar, StyleHISTORY & OTHER LIBERAL ARTS: History, Social Studies, Government, Political Science, etc.MATH: Arithmetic, Fractions, Algebra, Geometry, TrigonometrySCIENCE: Chemistry, Biology, PhysicsIndividualized TutoringEach student is different and I listen carefully so that our sessions are most productive. There is no substitute for one-on-one tutoring.Short Term or Long TermSome students have stayed with me their entire high school career. Others need just a bit of help to complete a difficult assignment. RatesIndividualized tutoring costs $90/hr for in-person or $60/hr for online. (AT LEAST UNTIL MAY  2022 CORONA VIRUS PRICING: $40/hr for online weekdays.) The introductory meeting is free without any obligation. I tutor online or in-person, and I use google docs and a whiteboard program for online students. Online tutoring works very well.NOTE: If your income has been disrupted due to the coronavirus, please indicate the hourly rate you are able to pay. ContactYou can text me or simply reply to this ad and we'll arrange a Zoom meeting.kenaritutor.com    ",True
2021-10-26T09:29:58-0700,https://sfbay.craigslist.org/sfc/lss/d/san-francisco-online-tutor-math-physics/7399436827.html,40,Usf / Panhandle,San Francisco,sf_bay_area,"Hi! Offering Math/Calculus, Physics and Chemistry online tutoring sessions for college and high school students. All levels. I have a mechanical engineering background and over 8 years of experience tutoring Math/Calculus, Physics and Chemistry to college and high school students. Affordable and convenient tutoring sessions online at $40 an hour using a shared board and audio platform. Expert in: - Math up to and including Calc 4 (differential equations) - Linear Algebra - Physics (calculus and algebra based) - Inorganic chemistry - Fundamentals of Engineering exam (ME)- SAT Math, SAT Math Levels 1&2- GRE Math - ACT- AP Physics, AP Chemistry, AP Calculus AB, AP Calculus BCReply with what course you need tutoring in and I’ll be happy to help.    ",False
2021-10-25T14:36:55-0700,https://sfbay.craigslist.org/sfc/lss/d/san-francisco-college-course-math/7399132386.html,40,Downtown / Civic / Van Ness,San Francisco,sf_bay_area,"Instead of spending countless hours with the homework, tests, and quizzes, your online math classes, on any popular online platforms, could be assisted. Whether it is Pearson, Aleks, Blackboard, or Webassign, the years of experience navigating in these platform have helped many other students who received such service in the past to obtain their desired, above average passing results!The following online math classes are available for service:- Intermediate Algebra, College Algebra- Geometry, Trigonometry, PreCalculus- Calculus 1/2/3, Business Calculus- Statistics, Business Statistics, Bio/Psychology Statistics- Finite Math, Liberal Art MathEstimate based on the detail of each assignment or assessment, average $40 an hour. Please contact me at (626) 200-5922 at least few days prior to the due date of the assignment or assessment for smooth, comfortable remote experience.Thank you so much and I look forward to work with you!- Terry------------Keywords: Math, Homework, Test, Exam, tutor, proctor, proctorio, proctorU, Teacher, Helper, Completion, Complete, Online, Remote, Quizzes, Quiz Mathematics, College, Algebra, final, course, aleks, webassign, pearson, mymathlab, cengage, SPSS, mathxl, mcgraw-hill, apex, connectmath, connect, mystatlab, respondus lockdown, web, assign, Canvas, d2l, Desire2learn, professional, writing, assignment, assignments    ",False
2021-10-25T12:23:17-0700,https://sfbay.craigslist.org/sby/lss/d/san-jose-tutor-math-sciences-duc-pham/7399059257.html,None,San Jose East,South Bay,sf_bay_area,"I am Dr. Duc Pham, a Pharmacist Pharm D, a professional tutor for 7 years at San Francisco State University, Diablo Valley College. I have the Doctor Degree of Pharmacy, a Bachelor Science majoring in Biology Physiology. My professional works are Tutoring and Medical Health Care.Beside that, I also tutor math and sciences. I got all As in all these science classes. I especially have a passion to bring my educational knowledge to students to help them achieving a strong foundation of science, especially about math in order to be successful in college sciences class with As.I also help students to get into pharmacy school.I already took Calculus 1&2, Physics 1&2, Biology (advance classes) and Chemistry 1 with all As grades. Moreover, I had 3 years working as a professional math tutor at Diablo Valley College Math Lab Department from 2010 to 2013 and at San Francisco State University from 2013 until present. In there, I have tutored all different kinds of students from ages to foundation in math. Understanding their background helps me to find the most effective way to teach them to strengthen their math and achieve the best grades in class.Moreover, I am the leader of the math lab. And I always received great feedback from my professors, managers, and students, as well as develop our math lab network to help more and more students. I believe with my passion in sciences, grades that I achieved, and professional experiences that I honored from Diablo Valley College and San Francisco State University, I can dedicate well my education knowledge to students to achieve solid success with math and other science classes.I am willing to travel in San Jose, South bay Area.",False
2021-10-25T10:05:36-0700,https://sfbay.craigslist.org/eby/lss/d/berkeley-expert-math-stats-chem-physics/7398974561.html,None,Anywhere In California,East Bay,sf_bay_area,"Fall Semester/Quarter Class Tutoring, College Application Essay Assistance.We provide one on one online tutoring in Mathematics, Statistics, Chemistry, Physics, Biology, English and French. Our tutors have been educated at UC Berkeley, UCLA, USC, Pomona-Pitzer and Caltech (some with 4.00 gpas), including a former graduate instructor in Mathematics and Statistics. We tutor students from elementary all the way through advanced college level. Subjects tutored include:* Most math and statistics courses at college/university level.* All math courses high school level, up to AP Calculus and AP Statistics.* Chemistry, physics and biology courses at the high school level, including AP Chemistry, AP Physics and AP Biology.* English/writing courses at college/university level* English/writing courses at elementary/middle school/high school level, including AP English.* French courses at elementary/middle school/high school level, including AP Fench*College Application assistance, including feedback and editing.Charges are on a sliding scale per hour, depending on the subject being tutored. College courses are generally charged more than high school courses, due to additional preparation required.Late night appointments can be arranged.For more information and an individualized price quote, please respond to the Craigslist email link and we will get in contact with you.    ",False
2021-10-25T09:23:09-0700,https://sfbay.craigslist.org/sby/lss/d/sunnyvale-tutor-for-math-english/7398946844.html,None,Sunnyvale,South Bay,sf_bay_area,"Please text me at 408-877-5379.My name is Julia and I can help you with your tutoring needs.I have the experience, knowledge and skills to help you improve in your desired subject or test. I know what it takes to get a high score on the SAT, ACT, GMAT, GRE, LSAT and MCAT as well as get into a top tier school. Let me show you how to “crack the code” to success.Educational Background:University of Chicago (undergrad)Yale University (grad)SAT: 1540/1600ACT: 35/36GMAT: 780GRE: 330MCAT:520LSAT: 177Here are the areas I can help with:Basic Math, Pre-Algebra, Algebra 1 & 2, Intermediate Algebra, College Algebra, Problem Solving, Geometry, Pre-Calculus, CalculusGeneral Chemistry, College Chemistry, AP Chemistry, AP Physics, Mechanics, General Science, Biology, Earth Science, Quantum PhysicsEnglish, Essay writingTEST PREPARATION: SAT, ACT, GMAT, GRE, LSAT, PSAT, GED, HSPT, TOEFLI look forward to helping you.San Francisco. California, Alameda, Albany, American Canyon, Antioch, Atherton, Belmont, Belvedere, Benicia, Berkeley, Brentwood, Brisbane, Burlingame, Calistoga, Campbell, Clayton, Cloverdale, Colma, Concord, Corte Madera, Cotati, Cupertino, Daly City, Danville, Dixon, Dublin, East Palo Alto, El Cerrito, Emeryville, Fairfax, Fairfield, Foster City, Fremont, Gilroy, Half Moon Bay, Hayward, Healdsburg, Hercules, Hillsborough, Lafayette, Larkspur, Livermore, Los Altos, Los Altos Hills, Los Gatos, Martinez, Menlo Park, Mill Valley, Millbrae, Milpitas, Monte Sereno, Moraga, Morgan Hill, Mountain View, Napa, Newark, Novato, Oakland, Oakley, Orinda, Pacifica, Palo Alto, Petaluma, Piedmont, Pinole, Pittsburg, Pleasant Hill, Pleasanton, Portola Valley, Redwood City, Richmond, Rio Vista, Rohnert Park, Ross, St. Helena, San Anselmo, San Bruno, San Carlos, San Francisco, San Jose, San Leandro, San Mateo, San Pablo, San Rafael, San Ramon, Santa Clara, Santa Rosa, Saratoga, Sausalito, Sebastopol, Sonoma, South San Francisco, Suisun City, Sunnyvale, Tiburon, Union City, Vacaville, Vallejo, Walnut Creek, CA    ",False
2021-10-25T07:58:42-0700,https://sfbay.craigslist.org/sby/lss/d/sunnyvale-expert-tutor-for-writing/7398895734.html,"[90, 60, 40]",Cupertino,South Bay,sf_bay_area,"Don't wait to get a tutor! This applies to struggling students or brilliant ones, as I can help both achieve their best.Would your student perform better in his or her subjects with a weekly tutor? I am here to help. I am a master tutor with fifteen years of experience bringing out the best of my students. I can help your student improve their English and Math skills, and maximize both learning and grades.I earned a graduate degree from Harvard University, and I specialize adapting my teaching style to each unique student. Additionally, I have lived overseas for five years, and so I have a speciality helping students who have English as a second language (ESL). I can help you with the following:ENGLISH: English classes,Writing, Grammar, StyleHISTORY & OTHER LIBERAL ARTS: History, Social Studies, Government, Political Science, etc.MATH: Arithmetic, Fractions, Algebra, Geometry, TrigonometrySCIENCE: Chemistry, Biology, PhysicsIndividualized TutoringEach student is different and I listen carefully so that our sessions are most productive. There is no substitute for one-on-one tutoring.Short Term or Long TermSome students have stayed with me their entire high school career. Others need just a bit of help to complete a difficult assignment. RatesIndividualized tutoring costs $90/hr for in-person or $60/hr for online. (AT LEAST UNTIL MAY  2022 CORONA VIRUS PRICING: $40/hr for online weekdays.) The introductory meeting is free without any obligation. I tutor online or in-person, and I use google docs and a whiteboard program for online students. Online tutoring works very well.NOTE: If your income has been disrupted due to the coronavirus, please indicate the hourly rate you are able to pay. ContactYou can text me or simply reply to this ad and we'll arrange a Zoom meeting.kenaritutor.com    ",True
2021-10-24T21:51:18-0700,https://sfbay.craigslist.org/sby/lss/d/cupertino-math-and-chemistry-tutor/7398782741.html,None,Cupertino,South Bay,sf_bay_area,An experienced and knowledgeable teacher is available to slowly go over the course material with understanding.   Will work with students to improve their skills and their grades.  Explain what the teacher is trying to communicate.  What concepts are important and why. Long time teacher and tutor in the area.    ,False
2021-10-24T18:22:35-0700,https://sfbay.craigslist.org/eby/lss/d/pleasanton-experienced-math-tutor-all/7398742378.html,None,Bay Area,East Bay,sf_bay_area,"Hello my name is Sam and here are some of the math courses I tutor: - Elementary math - Pre Algebra - Algebra - Algebra 2- Trigonometry/Geometry- Pre calculus - CalculusI have been tutoring middle school, high school and college students for 6+ years. I graduated with my Bachelors Degree in Electrical Engineering in 2020 with a 4.0 GPA from San Jose State University. I will be conducting tutoring-sessions via an online platform convenient for you. I can also set up in-person sessions if that is of interest. I am serving all of the Bay Area. Please message me for more details or any questions    ",False
2021-10-24T16:41:18-0700,https://sfbay.craigslist.org/sfc/lss/d/san-francisco-remote-math-tutor-with/7398711277.html,None,Bayview,San Francisco,sf_bay_area,"What you receive when choosing ThatMathTutorGuy:*1-1 help via Google Meet or Zoom with ThatMathTutorGuy @55/hr for tutoring and @70/hr for standardized test prep *A Collaborative online whiteboard experience in real time (whiteboard features include: importing documents (or pictures) to draw over, built-in graphing, ability to draw shapes, built-in math formula editor, and more)*A copy of the whiteboard for later review (that is, the notes for that session) provided by link and email attachment*If wanted, follow-up questions/problems (aka homework) for further review*If wanted, step-by-step help using your calculator (see pictures for how this will appear when sharing screen). Students who have good calculator skills are at an advantage.*If wanted, a planned schedule to meet your goals (especially helpful for standardized test prep) *Standardized test-taking strategies and prep - avoiding simple mistakes, right mentality, mental preparation, NOT-type problems, pacing, etc.*A written identification of weaknesses - psychological, mathematical, or otherwise*Pro-rated pricing - so if you need to end the session early, you pay less*Detailed invoice describing the different topics coveredAbout ThatMathTutorGuy:My passion for math started in middle school when I helped students understand the very basics of how to add, subtract, multiply, and divide fractions. I continued into high school with recreational mathematics and participated in math competitions in my spare time. In college, I assisted in the math lab - a place where students could ask homework and general math questions in a 1-1 tutoring environment. Finally, I went to Texas A&M University where I received a PhD in several complex variables. During my time there, I assisted with teaching, tutoring, office hours, creating and grading assignments.Through those many years of grad school, I came to agree with students - math is hard! And pedagogically, I discovered that to learn math, you need to do math! Therefore when I teach and tutor, I do so with lots and lots of examples. I also tend to ask questions of my students that I might have if I were taking the course. This helps in summarizing ideas and cementing concepts.I'm passionate about helping students become better at math and developing their logical and creative skills to problem solve. I really like working with high school and college students in a one-on-one environment. And lately, the online environment has allowed me to provide remote instruction to a larger pool of students. Initially, I used Zoom and zoom whiteboard, but currently I use google meet and a specific online whiteboard. I find this combination runs flawlessly whereas Zoom whiteboard has had a history of glitches and doubling written text. Additionally, the whole online whiteboard can be saved and later reviewed!Finally, I have access to an incredibly large number of textbooks. Almost always when a student is using a particular textbook, I am able to find a personal copy that is identical or only slightly different (ie different edition). This helps parents feel more confident that their son or daughter is getting real direct help. Obviously, it also assists with communication between tutor and student, and helps in assigning problems for solidifying concepts.Rate: 55/hr for tutoring and 70/hr for standardized test prepHours: 10am - 11:59pm ET Online (Remote) OnlyEmail: thatmathtutorguy314@gmail.comWebsite: https://thatmathtutorguy.business.site/Payment Accepted: Direct Deposit, Square, Zelle, Venmo, CashApp, PaypalTopics include: Standardized Test Prep (Math ISEE, Math SAT, Math ACT, etc), Algebra, Geometry, Trig., Pre-Calculus, Calculus (AP or not, 1,2 or 3), Linear Algebra, Differential Equations, Real Analysis (Undergrad), Complex Analysis, Topology, Problem Solving (AMC10, AMC12, AIME, etc), and more.    ",False
2021-10-23T13:06:18-0700,https://sfbay.craigslist.org/eby/lss/d/lafayette-tutor-harvard-grad-30-years/7398239110.html,None,Lafayette / Orinda / Moraga,East Bay,sf_bay_area,"Hi,My name is Chris Dingman. I'm a uniquely qualified, Bay Area-based math, science, writing, and SAT/ACT tutor.For the past year or so, I have done all tutoring online, which works well for one-on-one (less well for teaching groups!), but being fully vaccinated, I am now offering both in-person and online options.Since graduating summa cum laude from Harvard in 1987, I've been tutoring both in-person and online, teaching in both classrooms and homeschools, and helping various companies develop educational materials. In more than 30 years as a teacher and tutor, I have taught every middle and high school math course from pre-algebra through Calculus, and every high school science course. I am also a professional writer. I can help with: MATH: from basic arithmetic  through pre-algebra, algebra I, algebra II, geometry, trigonometry, pre-Calculus, and Calculus SCIENCE: including biology, chemistry, and physicsWRITING: including organizational help, sentence structure/style, and grammarI also specialize in ACT and SAT test prep. Along with my private practice, I've worked with educational content developers in the San Francisco Bay Area, which specialize in the creation and delivery of test-prep materials. You can find out more about me at my website at www.AchieveWithEaseTutoring.com, or read below for a little more about what I offer. My Approach:Teaching isn’t just knowing the answers. It’s an art. Current circumstances of course prohibit classroom teaching, but classrooms are often not the best environments in which to practice the art of teaching anyway. Working with me, teens feel a sense of calm and  confidence that allows them to think clearly, ask questions, tap into their natural desire to succeed, and to succeed.My tutoring approach is easy-going, focused, and highly individualized. These three elements complement and amplify each other. Time spent with me is more efficient and effective than classroom instruction, which must use what I call a one-size-fits-none approach. I help create a relaxed atmosphere and authentic connection that puts students at ease and allows optimal learning. Students often succeed with me even when they've been frustrated by subjects or other tutors and teachers. Students almost always see both their confidence and grades go up.I have outstanding references available on request.Online Tutoring PlatformsSkype or Gmail Video Chat are effective and convenient ways to tutor. While maintaining a visual connection to the student, I can use my computer as a whiteboard which I share with the student. (All whiteboard notes can be sent to the student after the session.)ContactYou can contact me from my website at www.achievewitheasetutoring.com, or call me at 510-499-5979.I look forward to hearing from you with any questions you may have.Chris    ",False
2021-10-23T13:05:43-0700,https://sfbay.craigslist.org/nby/lss/d/greenbrae-tutor-harvard-grad-30-yrs/7398238811.html,None,Kentfield / Ross,North Bay,sf_bay_area,"Hi,My name is Chris Dingman. I'm a uniquely qualified, Bay Area-based math, science, writing, and SAT/ACT tutor. For the past year or so, I have done all tutoring online, which works well for one-on-one (less well for teaching groups!), but being fully vaccinated, I am now offering both in-person and online options.  I offer tutoring to both single students or groups, though I believe one-on-one tutoring is usually the most helpful. Since graduating summa cum laude from Harvard in 1987, I've been tutoring both in-person and online, teaching in both classrooms and homeschools, and helping various companies develop educational materials. In more than 30 years as a teacher and tutor, I have taught every middle and high school math course from pre-algebra through Calculus, and every high school science course. I am also a professional writer. I can help with: MATH: from basic arithmetic  through pre-algebra, algebra I, algebra II, geometry, trigonometry, pre-Calculus, and Calculus SCIENCE: including biology, chemistry, and physicsWRITING: including organizational help, sentence structure/style, and grammarI also specialize in ACT and SAT test prep. Along with my private practice, I've worked with educational content developers in the San Francisco Bay Area, which specialize in the creation and delivery of test-prep materials. You can find out more about me at my website at www.AchieveWithEaseTutoring.com, or read below for a little more about what I offer. My Approach:Teaching isn’t just knowing the answers. It’s an art. Current circumstances of course prohibit classroom teaching, but classrooms are often not the best environments in which to practice the art of teaching anyway. Working with me, teens feel a sense of calm and  confidence that allows them to think clearly, ask questions, tap into their natural desire to succeed, and to succeed.My tutoring approach is easy-going, focused, and highly individualized. These three elements complement and amplify each other. Time spent with me is more efficient and effective than classroom instruction, which must use what I call a one-size-fits-none approach. I help create a relaxed atmosphere and authentic connection that puts students at ease and allows optimal learning. Students often succeed with me even when they've been frustrated by subjects or other tutors and teachers. Students almost always see both their confidence and grades go up.I have outstanding references available on request.Online Tutoring PlatformsSkype or Gmail Video Chat are effective and convenient ways to tutor. While maintaining a visual connection to the student, I can use my computer as a whiteboard which I share with the student. (All whiteboard notes can be sent to the student after the session.)ContactYou can contact me from my website at www.achievewitheasetutoring.com, or call me at 510-499-5979.I look forward to hearing from you with any questions you may have.Chris    ",False
2021-10-23T10:51:36-0700,https://sfbay.craigslist.org/sby/lss/d/zoom-tutoring-stanford-phd-tutor-math/7398166339.html,50,Cupertino,South Bay,sf_bay_area,"I specializes in one-on-one tutoring for all levels of math and science. I am calm, patient and encouraging and am experienced at working with students of all ages, ranging from middle school through college.  My goal as tutors is to create a positive learning environment and to encourage students to be curious, ask questions and think analytically. Depending on scheduling and convenience, I meet students at their home, a cafe or a public library. If interested, please email me and we will devise a game plan to get you started! My fee is $50/h. Subjects:"" * Math: middle school, high school and college level (including pre-algebra, algebra, geometry, trigonometry, pre-calculus, calculus and more) * Chemistry: high school and college level (including AP Chemistry) * Physics: high school and college level (including AP Physics) * SAT/ACT prep (math)(zoom tutoring only due to COVID19)    ",False
2021-10-22T17:53:55-0700,https://sfbay.craigslist.org/pen/lss/d/south-san-francisco-math-tutor-algebra/7397909120.html,25,South San Francisco,Peninsula,sf_bay_area,"If you need an online or in-person Math Tutor on the following subjects at Middle School,  High School,  or College level, we can help you! Tutorials: Mathematics, Algebra 1 & 2, Geometry, Trigonometry, PreCalculus, AP Calculus/Calculus, AP Statistics/Statistics, Linear Algebra, Physics, and Econometrics. Test Preparations:  SAT, SSAT, ISEE, and Electrical Apprenticeship Math.Rate starts at $25/hour    ",False
