date_posted;price;city;subregion;region;post_text;posts_scraped_on
2021-12-10T16:57:49-0800;65.0;Palo Alto;Peninsula;sacramento;Need extra help to further excel in your desired subject? I am an experienced Math and Physics tutor to provide learning services to students in high school and college to improve in their courses. I have my PhD in Applied Physics from Stanford University and my undergraduate degree in Engineering Physics, specializing in Electrical Engineering. I am available via zoom or in person locally in the Peninsula and East Bay Area.High school courses $60/hrCollege courses $70/hrPlease feel free to reach out if you have any questions or are interested in my services. Thank you.;2021-12-23
2021-12-10T15:03:53-0800;45;Berkeley;East Bay;sacramento;Former UC-Berkeley economics Ph.D. student and TA offers virtual tutoring for undergraduate and secondary school economics and math classes. Rush notice and latenight availability may be available. Undergraduate rates: $45/hour for lower division courses and $55/hour for upper division courses. Secondary rates: $40/hour for regular classes, $50/hour for AP/gifted classes.Full payment is required at the beginning of the lesson.    ;2021-12-23
2021-12-09T10:52:36-0800;25;San Jose North;South Bay;sacramento;Hello Everyone, My name is Rinki and  I teach maths and science for elementary, middle school and high school students .I have been tutoring math and science for more than 2 years in India.I have a bachelor degree in computer science (engineering) and have a working experience of more than 7 years in Information technology industry. My goal is helping students to achieve various goals (improving GPA, establishing the way to study, developing problem solving skill..)The cost is $25 /hr and first class is free. I take cash and Debit/credit cards (square), and Venmo/Cashapp, Zelle,Apple PayCell no. 4084251341    ;2021-12-23
2021-12-09T10:02:16-0800;70.0;San Rafael;North Bay;sacramento;"All levels of Math and Physics.I am very patient, sensitive to students needs and treat everyone with kindness and compassion.Reference available upon request.One of my students wrote,""Hi Hiro,I hope this email finds you well. My name is JT, I was tutored by you in AP Physics last year. I took the test in May, and for some reason, all of my AP tests took an extra long time to be graded. I recently got my scores, and I am very happy to report to you that I got a 4 on the AP Physics test.I just wanted to thank you for all your help. I know I would not have been able to get this score without you! All of your help was greatly appreciated.  :)Regards,""Hiro KobayashiMaster of Science in PhysicsBachelor of Science in Computer EngineeringCalifornia teaching Credentials in Physics and Mathematics$60/45 min, $80/60 min415-250-4831    ";2021-12-23
2021-12-08T13:38:26-0800;45;San Jose;South Bay;sacramento;Hello All,My name is Qusai. I have been a tutor and a teaching assistant for over 7 years. I recently graduated from UC Santa Barbara where I used to teach undergraduate students. I have taught and tutored more than 200 students and have put in more than 300 hours of teaching time. The most important aspect of tutoring, in my opinion, is to identify and fill in gaps in their knowledge. The last thing you want is your child having trouble with a specific concept because their foundation was shaky. I can help make sure there are no gaps in their knowledge and make sure they are performing well in school.Some places I have taught:- Los Angeles Pierce College- UC Santa Barbara- For a Company in Shanghai, China- Private Clients in LASpecialty Subjects:- Algebra 1- Algebra 2- Geometry- Precalc- Math Analysis- Trigonometry- Chemistry 1- Biology- Essay WritingQualifications:Undergrad: UC BerkeleyGrad: UC Santa Barbara(Check out some of my reviews in the images attached)If you are looking to help your child in high school or college, reach out to me. I can help break things down and get them back on track towards a positive future.Rate: $45/hourOnline TutoringNote: I have all the tools for effective online tutoring including screen share and a stylus/digital whiteboard.Text, call, or email- Qusai from QS Tutoring;2021-12-23
